{
  "ledger_version": "1.0.0",
  "forecast_family": "lims-eln-replatforming-outcomes",
  "entries": [],
  "empty_state": {
    "status": "awaiting_independently_observed_outcomes",
    "statement": "The first independently observed resolution activates Brier scoring; forecast exercises serve as comparison inputs until then."
  }
}
